### ISSUE TITLE
Repeated 400 Bad Request errors

### ISSUE THREAD

**Issue by GoogleCodeExporter** [archiecobbs/s3backer#3]
```
Very often after some errors (HTTP timeout, 500) s3backer starts to
generate "400 Bad Request" errors and locks in that condition (until retry
timeout and give up message).

By using tcpdump I have found the same pattern:

(Some network error - unplugging cable is enough).

20:04:35.281374 IP macbook.58450 > s3.amazonaws.com.http: tcp 365
E...4.@.@.'....eH....R.Pc....e..P...Ss..PUT /du-backup3/macos0000080f HTTP/1.1
Us
20:04:35.603823 IP s3.amazonaws.com.http > macbook.58450: tcp 25
E(.A..@...W.H......e.P.R.e..c...P..&JD..HTTP/1.1 100 Continue



20:04:55.613733 IP s3.amazonaws.com.http > macbook.58450: tcp 630
E(....@...U.H......e.P.R.e.-c...P..&R...HTTP/1.1 400 Bad Request
x-amz-request-id
20:04:55.614898 IP s3.amazonaws.com.http > macbook.58450: tcp 5
H......e.P.R.e..c...P..&9...0


And these messages go until retry timeout.

It looks like s3backer starts PUT request, S3 answers "100 Continue",
nothing happens for 20 seconds and then S3 says "400 Bad Request". S3backer
complaints in syslog, waits and repeats the same pattern.

It happens with s3backer 1.0.4 on Mac OS X 10.5.4

s3backer connect string:

s3backer --prefix=macos --size=75M --filename=<local-file>
--maxRetryPause=5000000 -o daemon_timeout=3600 <bucket> <local-dir>

I am writing file with dd:
dd if=<another local file> of=<local-file on s3backer> bs=4096

tcpdump called like this:
tcpdump -i en1 -A -q 'tcp and (((ip[2:2] - ((ip[0]&0xf)<<2)) -
((tcp[12]&0xf0)>>2)) != 0)'
```

Original issue reported on code.google.com by `dimaulu...@gmail.com` on 10 Jul 2008 at 12:21
